Question no.,MCQ,Choices,Correct
1,What is the main goal of General AI?,a: Perform a specific task efficiently | b: Think like a human on its own | c: React to current situations | d: Store past memories for future actions,b
2,Which type of AI can surpass human intelligence and perform any cognitive task better than humans?,a: Narrow AI | b: General AI | c: Super AI | d: Reactive Machines,c
3,What is the characteristic of Reactive Machines?,a: Store past memories for future actions | b: React to current situations | c: Think like a human on its own | d: Perform a specific task efficiently,b
4,What is the main feature of Strong AI?,a: Perform a specific task efficiently | b: Think like a human on its own | c: Surpass human intelligence | d: React to current situations,b
5,"Which type of AI system understands emotions, beliefs, and requirements like humans?",a: Reactive Machines | b: Limited Memory | c: Theory of Mind | d: Self-Awareness,d
